{
  "CatalogGroupId": "500123",
  "CatalogItemId": "500123",
  "IsArchived": true,
  "MinSelectCount": 3,
  "MaxSelectCount": 3,
  "Products": [],
  "Metafields": [],
  "GroupType": "ModifierGroup",
  "Sku": "string",
  "Name": "Example Name",
  "AutogenerateDisplayText": true,
  "ImageFileName": "Example Name"
}